{
  "$schema": "../apps-manager/lib/app.schema.json",
  "id": "gweb.app.settings",
  "title": "Settings",
  "slug": "settings",
  "version": "1.0.0",
  "addToDock": true,
  "bin": "@/features/settings-app/component/settings-app.tsx",
  "icon": {
    "24@2x": "/apps/24x24@2x/settings-app.png",
    "256@2x": "/apps/256x256@2x/settings-app.png",
    "48@2x": "/apps/48x48@2x/settings-app.png"
  },
  "sidebar-view": {
    "appearance": {
      "sidebarButton": "Appearance",
      "subTitle": "Appearance",
      "icon": "/scalable/apps/settings/settings-appearance-symbolic.svg"
    }
  }
}
